Job ID,Job Link,Resume Tried,Date listed,Date Tried,Assumed Reason,Stack Trace,External Job link,Screenshot Name
4387170235,https://www.linkedin.com/jobs/view/4387170235,Pending,2026-03-21 11:16:06.835440,2026-04-11 11:16:06.882283,Asking for Security clearance,"
About the job
Brock Solutions is an innovative engineering solutions and professional services company specializing in the design, build and implementation of real-time operational solutions for broad based industrial/manufacturing and transportation/logistics organizations worldwide. Some interesting areas we are exploring include industrial automation, machine learning, IIOT, cyber security, AI, robotics, and other technologies. With approximately 900+ employees globally, Brock Solutions is a privately held, employee owned organization with over 30 years in the real-time operational solutions space.

As Brock Solutions continues to grow and respond to the on-going requirements of major clients, we need to add talent to our base of outstanding professionals. We are currently seeking a Software Integration Engineer to join our team of experienced professionals.

Working with our other highly motivated developers, you will be involved in the entire life cycle of the software engineering process.

Employee-owned company with profit sharing, comprehensive benefits, company events and charitable initiatives, a diverse workplace, BBQs and Lunch and Learns, Sports teams, Group fitness initiatives, and a ""We win as a Team"" culture are just some of the reasons our employees love working at Brock!

Why Work at Brock?
Competitive compensation package
Profit sharing
Continuous career growth
Flexible working hours
Company events and celebrations
Travel Opportunities

Responsibilities may include:
Work with a multi-disciplinary team to deploy and configure software to customer test and production environments
Configure and set up server hardware and peripheral devices (printers, scanners, Bluetooth devices)
Modify product code to meet customer's unique needs
Demonstrate complete integrated system with key external stakeholders during functional acceptance testing and on-site system testing
Root cause analysis of defects identified in production
Maintain, develop, and improve our automated test and deployment tools
Performing other duties as assigned by Project Manager

Requirements
Bachelors degree in IT, Software Engineering, Computer science or related fields
Preferred 1-3 years experience (co-op considered).
Must be an Australian citizen or permanent resident
Excellent communication skills, both verbal and written
Strong troubleshooting skills
Proficiency with SQL and knowledge of databases
Experience with an object-oriented programming language is required. C# is preferred but Java, C++ and other languages are also acceptable
Knowledge of Flyaway, Powershell, Azure Devops, Python and Ignition is an asset
The ability to travel and perform night/weekend work on occasion
Must meet federal security clearance requirements

We appreciate your interest in joining our team.

Please note that: (a) all applicants must be legally entitled to work in the country where the position is located; and (b) some roles require eligibility for government security clearances or site access, which may require citizenship or lawful permanent resident status under the applicable policies and regulations.

Brock Solutions strives to create a respectful, accessible and inclusive work environment. Upon individual request, Brock Solutions will endeavour to remove barriers to the hiring process to accommodate those candidates with disabilities.

Please be advised that, outside of our official applicant tracking system, Brock Solutions will never solicit personal information upfront. We send formal offer documentation in writing first, and wait until your acceptance before asking for any additional personal information.

Found ""Clearance"" or ""Polygraph"". Skipping this job!
",Skipped,Not Available
4392484939,https://www.linkedin.com/jobs/view/4392484939,Pending,2026-04-04 11:17:33.819001,2026-04-11 11:17:33.911688,Asking for Security clearance,"
About the job
Location: Melbourne / Hybrid
Role Type: Permanent, Full-Time
Security Requirement: Baseline Clearance Eligibility Required
Australian Citizenship required. 

Position Overview
We are seeking a highly accomplished Lead Systems Engineer to serve as a technical authority and strategic technical architect for our hybrid infrastructure. This is a ""strong generalist"" role designed for a professional who possesses deep technical mastery across the Microsoft 365 and AWS ecosystems, paired with the commercial acumen to drive long-term IT strategy.

The successful candidate will lead the transition from legacy infrastructure to a modern Zero Trust architecture, ensuring our global environment is secure, automated, and cost-optimized. You will act as a bridge between complex technical execution and executive leadership, translating sophisticated infrastructure requirements into clear business outcomes.

Strategic Leadership & Communication
Executive Technical Liaison: Act as a primary advisor to the leadership team, possessing the ability to articulate complex technical concepts to non-technical stakeholders with clarity and precision.
Infrastructure Roadmap: Contribute to the development and execution of a multi-year IT strategy that aligns with organizational growth and security objectives.
Financial Stewardship: Conduct regular audits of Microsoft 365 licensing (Business vs. Enterprise) and cloud consumption (AWS/Azure) to identify cost-saving opportunities and ensure maximum return on investment.
Technical Mentorship: Lead by example, fostering a culture of high performance, thorough documentation, and continuous improvement within the engineering team.


Key Technical Responsibilities
Modern Workplace & Identity: Provide expert-level administration of the Microsoft 365 tenant, with a focus on Intune (Endpoint Manager) for Autopilot and compliance, SharePoint Online architecture, and Exchange Online security.
Identity & Access Management (IAM): Act as the primary architect for Entra ID (Azure AD). Oversee the lifecycle of Enterprise Applications, including SAML/OIDC SSO integrations, App Registrations, and Conditional Access policies to ensure secure, seamless user authentication.
Zero Trust Networking: Architect and manage Zscaler (ZIA & ZPA) environments to provide secure, seamless access to internet and private resources, replacing traditional VPN dependencies.
Cloud Engineering (AWS & Azure): Design and optimize our primary AWS footprint, focusing on Application Load Balancers (ALB), VPN Gateways, and Route 53. Maintain and govern Azure workloads and Entra ID (Azure AD) integrations.
Core Infrastructure Services: Oversee the integrity of Active Directory, Group Policy (GPOs), DHCP, and DNS. Manage the Microsoft PKI (AD CS) environment to support RADIUS (NPS) and certificate-based authentication (802.1X).
Automation & DevOps: Drive operational efficiency through advanced PowerShell scripting and API integrations (Microsoft Graph). Manage and maintain Docker container environments for modern application delivery.


Required Qualifications & Skills
Communication: Exceptional verbal and written communication skills; demonstrated ability to ""explain complex topics simply"" to diverse audiences.
Security Mindset: A proactive approach to security validation, ensuring all infrastructure aligns with the ACSC Essential Eight and modern cybersecurity frameworks.
Experience: 7+ years in Systems Engineering, with at least 3 years experience at a Senior Systems Engineer or Senior Infrastructure Engineer capacity managing enterprise-scale hybrid environments.
Technical Breadth: Expert knowledge of Windows Server (2016-2022), Windows Desktop, and high-availability networking protocols (BGP, OSPF, VLANs).
Clearance: Must hold, or be eligible to obtain, an Australian Government Baseline Security Clearance (requires Australian Citizenship).


Why This Position?
This role offers the opportunity to move beyond routine maintenance and into a position of genuine technical architectural influence. You will have the autonomy to select best-in-class tools, the responsibility to manage significant cloud budgets, and the platform to shape the future of our digital infrastructure.


About Us
Service Stream is an equal opportunity ASX listed business that develops and operates Australia’s essential service networks across telecommunications, utilities, transport, defence, and social infrastructure industries. We keep communities connected.


Benefits of working with us include:
Flexible working – We genuinely consider all flexibility requests.
Growth – Career development opportunities across our expanding business.
Discounts – Access to hundreds of major retailers including Woolworths, Airbnb, JB Hi-Fi, and Bupa.
Paid leave – Parental, cultural, community service, study, corporate volunteering, and purchased leave.
Culture – A workplace that values diversity, inclusion, and celebrates excellence.


How to apply
Please submit your interest via the Apply button, where you will be directed to create a profile in our system.

We celebrate diversity at Service Stream and welcome applications from Aboriginal and/or Torres Strait Islander peoples, people with disabilities or neurodivergence, and those from LGBTIQA+, Veteran, or other diverse groups.

Applications will not be accepted via email. If you require reasonable adjustments during the recruitment process, please contact: talent.corporate@servicestream.com.au

Found ""Clearance"" or ""Polygraph"". Skipping this job!
",Skipped,Not Available
