Job ID,Job Link,Resume Tried,Date listed,Date Tried,Assumed Reason,Stack Trace,External Job link,Screenshot Name
4386966126,https://www.linkedin.com/jobs/view/4386966126,Pending,2026-04-09 11:12:20.809556,2026-04-11 11:12:20.850421,Found a Bad Word in About Job,"
About the job
GitLab is the intelligent orchestration platform for DevSecOps. GitLab enables organizations to increase developer productivity, improve operational efficiency, reduce security and compliance risk, and accelerate digital transformation. More than 50 million registered users and more than 50% of the Fortune 100* trust GitLab to ship better, more secure software faster.

The same principles built into our products are reflected in how our team works: we embrace AI as a core productivity multiplier, with all team members expected to incorporate AI into their daily workflows to drive efficiency, innovation, and impact. GitLab is where careers accelerate, innovation flourishes, and every voice is valued. Our high-performance culture is driven by our values and continuous knowledge exchange, enabling our team members to reach their full potential while collaborating with industry leaders to solve complex problems. Co-create the future with us as we build technology that transforms how the world develops software.

Fortune 500® is a registered trademark of Fortune Media IP Limited, used under license. Claim based on GitLab data. Fortune 100 refers to the top 20% ranked companies in the 2025 Fortune 500 list, published in June 2025. Fortune and Fortune Media IP Limited are not affiliated with, and do not endorse products or services of GitLab.

An overview of this role

As an Intermediate Backend Engineer on our next-generation Security Platform Management team, you will help build GitLab’s enterprise security solutions from the ground up. You’ll design and develop greenfield backend services that close competitive gaps and position GitLab as a single platform for enterprise security, directly shaping how thousands of organizations understand and manage their security posture at scale. Working closely with a distributed team of 8 engineers, a Product Manager, and a UX designer across the US, Israel, and India, you’ll own critical backend systems and APIs that power capabilities like a new Security Manager role system, asset inventory with posture sharing, logical asset gathering with statistics, and unified configuration for GitLab’s security tools.

Some Examples Of Our Projects

Building a new Security Manager role system to centralize and streamline security administration
Creating assets inventory and posture sharing capabilities, including logical asset gathering and unified configuration for all GitLab security tools

What you’ll do

Design and develop next-generation Security Platform Management capabilities that strengthen GitLab’s enterprise security offering
Build and optimize scalable backend services and data models in Ruby on Rails with PostgreSQL for large volumes of security data
Develop and maintain robust REST and GraphQL APIs that power security workflows across the GitLab platform
Collaborate with Infrastructure, Policies, and Security Insights teams to deliver cross-functional security features end to end
Implement and refine unified configuration mechanisms for GitLab’s suite of security tools to simplify management at scale
Work within focused, feature-specific squads to deliver high-impact, well-tested functionality with minimal context switching
Contribute to technical design decisions, code reviews, and standards that shape the architecture of GitLab’s security platform

What you’ll bring

Proficiency in backend development with Ruby on Rails, including building and maintaining production services
Experience designing and optimizing PostgreSQL schemas and queries for large-scale data
Experience building and maintaining REST and GraphQL APIs that integrate with complex products or platforms
Familiarity with Git-based workflows and continuous integration and delivery (CI/CD), ideally using GitLab
Knowledge of Elasticsearch and NoSQL database technologies, or interest in learning and applying them
Experience working in collaborative, cross-functional teams with product management and design
Ability to work autonomously in an all-remote, asynchronous environment while staying aligned with team goals
Interest in security domains and in building scalable, reliable solutions for enterprise customers, with openness to transferable experience from related areas

About The Team

The Security Platform Management team sits within GitLab’s Security Risk Management area and is responsible for building new platform capabilities that help enterprises understand, manage, and improve their security posture inside GitLab. Our team consists of 8 backend engineers, 1 Product Manager, and 1 UX designer distributed across the US, Israel, and India, and we collaborate asynchronously and organize into feature-specific squads to deliver focused outcomes. We own initiatives such as the new Security Manager role system, security assets inventory with posture sharing, logical asset gathering and statistics, and unified configuration for GitLab’s security tools. Our main opportunity is greenfield: we are designing and shipping net-new enterprise security solutions rather than maintaining legacy systems, and defining how large organizations use GitLab to secure applications at global scale.

The base salary range for this role’s listed level is currently for residents of the United States only. This range is intended to reflect the role's base salary rate in locations throughout the US. Grade level and salary ranges are determined through interviews and a review of education, experience, knowledge, skills, abilities of the applicant, equity with other team members, alignment with market data, and geographic location. The base salary range does not include any bonuses, equity, or benefits. See more information on our benefits and equity. Sales roles are also eligible for incentive pay targeted at up to 100% of the offered base salary.

United States Salary Range

$98,000—$210,000 USD

How GitLab Supports Full-Time Employees

Benefits to support your health, finances, and well-being
Flexible Paid Time Off 
Team Member Resource Groups
Equity Compensation & Employee Stock Purchase Plan
Growth and Development Fund
Parental leave 
Home office support

Please note that we welcome interest from candidates with varying levels of experience; many successful candidates do not meet every single requirement. Additionally, studies have shown that people from underrepresented groups are less likely to apply to a job unless they meet every single qualification. If you're excited about this role, please apply and allow our recruiters to assess your application.

Country Hiring Guidelines: GitLab hires new team members in countries around the world. All of our roles are remote, however some roles may carry specific location-based eligibility requirements. Our Talent Acquisition team can help answer any questions about location after starting the recruiting process.

Privacy Policy: Please review our Recruitment Privacy Policy. Your privacy is important to us.

GitLab is proud to be an equal opportunity workplace and is an affirmative action employer. GitLab’s policies and practices relating to recruitment, employment, career development and advancement, promotion, and retirement are based solely on merit, regardless of race, color, religion, ancestry, sex (including pregnancy, lactation, sexual orientation, gender identity, or gender expression), national origin, age, citizenship, marital status, mental or physical disability, genetic information (including family medical history), discharge status from the military, protected veteran status (which includes disabled veterans, recently separated veterans, active duty wartime or campaign badge veterans, and Armed Forces service medal veterans), or any other basis protected by law. GitLab will not tolerate discrimination or harassment based on any of these characteristics. See also GitLab’s EEO Policy and EEO is the Law. If you have a disability or special need that requires accommodation, please let us know during the recruiting process.

Contains bad word ""Ruby"". Skipping this job!
",Skipped,Not Available
4393094573,https://www.linkedin.com/jobs/view/4393094573,Pending,2026-04-04 11:13:39.428597,2026-04-11 11:13:39.486403,Found a Bad Word in About Job,"
About the job
Design, build and improve web applications that matter.

Join ACER’s Software Development team as a Front‑End Developer on a 6‑month fixed‑term, full‑time contract, collaborating on digital solutions that support education and research on a global scale.

This role is aligned to a time‑sensitive project for a prominent Australian client, offering an exciting opportunity to contribute to innovative, high‑impact interactive assessment solutions.

ABOUT ACER
The Australian Council for Educational Research (ACER) is an international, independent, not‑for‑profit organisation committed to improving learning through world‑class research, assessments and digital innovation. With around 400 staff across Australia, India, Malaysia, the UAE and the UK, ACER delivers impactful educational solutions worldwide.
Our Software Development team, within the Information Technology Division, works collaboratively across ACER to design, build and maintain high‑quality digital products that enable meaningful research and assessment programs.

ABOUT THE ROLE
We are looking for a mid‑level Front‑End Developer with strong JavaScript skills to support a critical project delivering interactive assessments.

In this role, you will:
Build interactive assessment modules based on established designs
Contribute to solution design, development and quality assurance
Take ownership of code quality, accessibility, security and maintainability
Troubleshoot and resolve issues as they arise

You’ll work closely with the Lead Software Engineer, Assessment Developers, UX Designers and Software Testers as part of a supportive, collaborative team.

WHAT YOU'LL BRING

Essential experience and skills:
3+ years’ commercial experience in JavaScript front‑end/web development
Strong object‑oriented design and development skills
Experience developing high‑quality, interactive web interfaces
Experience with PHP and/or Java in a commercial environment
Solid database design and SQL knowledge
Understanding of modern software development lifecycles and practices
Ability to deliver to project timelines in a self‑managed way
Clear communication skills and strong attention to detail

Qualifications:
Bachelor’s degree in Computer Science (or equivalent experience)

ABOUT YOU
You’re a capable and adaptable developer who enjoys working in a fixed‑term, project‑based role. You take pride in quality work, communicate clearly, and value collaboration within a technical team.

WHY JOIN ACER?
Purpose‑driven organisation with global impact
Inclusive, collaborative and values‑led culture
Opportunity to contribute to meaningful digital initiatives over a defined period

HOW TO APPLY
Be part of software development that supports better learning outcomes worldwide.
👉 Apply via LinkedIn or view the full position description at:
https://www.acer.org/au/about-us/careers

Applications close: Thursday, 16 April 2026 at midnight (AEST)

ACER is an equal opportunity employer committed to diversity, inclusion and accessibility. Aboriginal and/or Torres Strait Islander people are encouraged to apply. Adjustments can be requested at any stage of the recruitment process by contacting p&c@acer.org.

Contains bad word ""PHP"". Skipping this job!
",Skipped,Not Available
4384237382,https://www.linkedin.com/jobs/view/4384237382,Pending,2026-03-14 11:14:59.473500,2026-04-11 11:14:59.556227,Found a Bad Word in About Job,"
About the job
At Champion Data, our dedicated team are united by sport and driven by data. We strive to revolutionise and transform sport data globally by leveraging our cutting-edge technology and expert team, ensuring we deliver the best possible outcomes for our partners and clients.


About the job

Champion Data has an exciting opportunity for an Junior Broadcast Developer to join our team!
The Junior Broadcast Developer supports the development and maintenance of Champion Data’s broadcast and sports data technology platforms. Working under the guidance of senior engineers, this role contributes to the development of software solutions that power broadcast graphics, data systems, and analytics products used by sporting leagues and broadcasters.

The role focuses on developing technical capability, learning engineering best practices, and contributing to the delivery of reliable, high-quality software products.

Key Responsibilities

Software Development 
Assist in the development, testing, and maintenance of software applications.
Write clean, maintainable, and well-documented code following team development standards.
Contribute to the implementation of new features, enhancements, and bug fixes.
Participate in code reviews and incorporate feedback from senior developers.
Assist with the configuration and deployment of applications.

Collaboration & Team Support
Work closely with developers, product owners, and project managers to deliver software solutions.
Support the translation of business requirements into working technical solutions.
Communicate progress, issues, and blockers with the development team.
Participate in team meetings, sprint planning, and development discussions.

Quality & Testing
Assist in testing software to ensure functionality, performance, and reliability.
Help identify and resolve bugs and software issues.
Follow established coding standards, documentation practices, and development workflows.
Contribute to maintaining quality across Champion Data software systems.

Learning & Development 
Develop knowledge of Champion Data systems, tools, and development frameworks.
Build skills in programming, debugging, testing, and software design.
Learn and apply modern development practices such as version control, automated testing, and CI/CD.
Seek guidance and feedback from senior developers and mentors.

Product Contribution & Innovation
Contribute ideas for improving software solutions and development processes.
Support innovation within Champion Data’s broadcast and sports data products.
Assist with research into new technologies and development approaches where appropriate.

Technical Support
Assist with diagnosing and resolving technical issues affecting Champion Data applications.
Provide operational support for internal and external software systems where required.
Support troubleshooting of production or broadcast-related systems under guidance.


About You

Basic knowledge of software development principles and programming concepts.
Understanding of object-oriented programming.
Familiarity with version control systems (e.g., Git).
Strong problem-solving and analytical skills.
Good communication and teamwork abilities.
Experience with C# / .NET development.
Familiarity with desktop applications (WPF), APIs, or data-driven systems.
Exposure to real-time data systems or broadcast technology.
Interest in sports data, broadcast graphics, or live event technology.

Exposure and willingness to learn
Programming: C#, .NET
Frameworks: WPF / APIs / data services
Tools: Git, Visual Studio, CI/CD pipelines
Data: JSON, APIs, data processing
Practices: Agile development, code reviews, testing


Tell me more about Champion Data

For over 20 years, Champion data has been at the forefront of delivering sports stats globally. With a global presence in Australia, the USA, the UK, and Asia, we specialise in real-time data collection, storage, analysis, distribution, and visualisation. We track every play and movement, delivering unbeatable game intel through seamless integration systems. Our unrivalled visual packages, in partnership with leading media outlets, ensure a sensational sports broadcast experience. We work across numerous major sports, including AFL, NRL, Football, Horse Racing, World Netball, LIV Golf, Tennis, and Lacrosse. As we continue to expand globally, we aim to solidify our position as the leading sports data company.

At Champion Data, our people are at the core of our success, driving the innovation and passion that underpin our company culture. By joining our team, you will be part of a motivated group with a ‘can-do’ attitude, eager to embrace challenges and committed to personal and professional growth. At Champion Data we will enable you to be your own champion.


Our Core Values:
To challenge the Playbook / To be an Elite Partner / To Champion Team


Why Join Champion Data?

We offer flexible hybrid working arrangements, financial support for setting up a remote workspace and a strong focus on health and wellbeing. Our team culture is vibrant and supportive, including regular social events, team lunches, and more. We also provide extensive employee benefits, including access to our wellness program and additional leave through Mindful Me Days.


What benefits does Champion Data offer the team in Australia? 

Mindful Me Days: Four days per year dedicated to your wellbeing
Flexible Working: Our team works globally in a hybrid environment, which includes two weeks per year, during which you can work remotely from anywhere worldwide.
AUS Office: Access to a newly renovated office in Southbank, Melbourne.
Our spaces: all of our offices have great end-of-journey facilities; including showers, wellness/prayer room & games
Employee Assistance Programs: 24/7 Access to financial support and counselling
Wellness Incentive: To help support your home office setup or contribute towards a wellness activity/service of your choosing
Get to the Game:  Funds towards tickets for you and your family/friends to attend sporting events globally.
Advance You Learning and Development: Annual budget to spend on learning and development activities plus Brain Block Time, this is time set aside monthly to learn or study.
LinkedIn Learning: Access to an external learning platform LinkedIn Learning
Social Events: Including an annual Family Day & Volunteer Day
Paid Parental Leave

When you join Champion Data, you will have the opportunity to step into a fast-growing, dynamic business during an exciting period of expansion. Each day brings new challenges and opportunities to collaborate with diverse clients across the sports, technology, and broadcast media industries.

We look forward to hearing from you and welcoming you to Champion Data.

#thestorybehindthegame

Contains bad word "".NET"". Skipping this job!
",Skipped,Not Available
4389707272,https://www.linkedin.com/jobs/view/4389707272,Pending,2026-03-28 11:15:56.168220,2026-04-11 11:15:56.210083,Found a Bad Word in About Job,"
About the job
Description

AWS Infrastructure Services owns the design, planning, delivery, and operation of all AWS global data centre infrastructure. In other words, we’re the people who keep the cloud running. We support all AWS data centres and all the servers, storage, networking, power, and cooling equipment that ensure our customers have continual access to the innovation they rely on. We work on the most challenging problems, with thousands of variables impacting the supply chain — and we’re looking for talented people who want to help support these challenges.

You’ll join a diverse team of software, hardware, and network engineers, supply chain specialists, security experts, operations managers, and other vital roles. You’ll collaborate with people across AWS globally to help us deliver the highest standards for safety and security while providing seemingly infinite capacity at the lowest possible cost for our customers. And you’ll experience an inclusive culture that welcomes bold ideas and empowers you to own them to completion.

You will be a valued member of an exceptional global team working on local problems, thriving in a dynamic and enthusiastic environment that combines dedication and enjoyment.

At Amazon Web Services (AWS), you will get hands-on experience with tools and services that exist outside the scope of native AWS products. This presents an exciting opportunity to engage with systems you might not encounter otherwise, allowing you to gain invaluable experience in infrastructure development.

Key job responsibilities

 Experience in technical support, or experience troubleshooting and debugging technical systems Experience scripting in modern program languages
 Hold or be able to attain an Australian Government Security Vetting Agency clearance (see https://www.agsva.gov.au/applicants/eligibility-and-suitability)

A day in the life

 Dive deep to pinpoint the underlying causes of software-based issues, providing valuable assistance in escalations when necessary.
 Apply Linux expertise to troubleshoot, innovate solutions, and resolve technical issues.
 Efficiently managing ticket queues for both our internal team and partner service teams ensuring service level agreements (SLAs) are met.
 Leading the team to enhance operational efficiency by analysing root causes, trends and developing metrics, procedures, tools and documentation.
 Engaging with internal service teams to contribute to company-wide initiatives, including tasks such as patching, operating system migrations, and code releases.
 Working with various internal software development teams to actively enhance systems and services within the team’s scope.
 Collaborating closely with experienced engineers and actively engaging in knowledge-sharing sessions with the team.

About The Team

At AWS Infrastructure Reliability Engineering Organization (IREO), we're the team behind the scenes keeping AWS's vast infrastructure running smoothly. Think of us as the guardians of the cloud's foundation - we're the ones who ensure that when millions of customers hit 'deploy' or 'launch,' everything just works.

Our team is a unique blend of problem solvers, systems thinkers, and infrastructure enthusiasts. We don't just maintain systems; we innovate, automate, and continuously push the boundaries of what's possible in infrastructure reliability. Whether we're developing new automation tools, responding to complex technical challenges, or optimising our global systems, we're always thinking several steps ahead.

Diverse Experiences

Amazon values diverse experiences. Even if you do not meet all of the preferred qualifications and skills listed in the job description, we encourage candidates to apply. If your career is just starting, hasn’t followed a traditional path, or includes alternative experiences, don’t let it stop you from applying.

Why AWS

Amazon Web Services (AWS) is the world’s most comprehensive and broadly adopted cloud platform. We pioneered cloud computing and never stopped innovating — that’s why customers from the most successful startups to Global 500 companies trust our robust suite of products and services to power their businesses.

Work/Life Balance

We value work-life harmony. Achieving success at work should never come at the expense of sacrifices at home, which is why we strive for flexibility as part of our working culture. When we feel supported in the workplace and at home, there’s nothing we can’t achieve in the cloud.

Inclusive Team Culture

AWS values curiosity and connection. Our employee-led and company-sponsored affinity groups promote inclusion and empower our people to take pride in what makes us unique. Our inclusion events foster stronger, more collaborative teams. Our continual innovation is fueled by the bold ideas, fresh perspectives, and passionate voices our teams bring to everything we do.

Mentorship and Career Growth

We’re continuously raising our performance bar as we strive to become Earth’s Best Employer. That’s why you’ll find endless knowledge-sharing, mentorship and other career-advancing resources here to help you develop into a better-rounded professional.

Basic Qualifications

 Knowledge of networking protocols such as HTTP, DNS and TCP/IP
 1+ years of technical support experience
 Experience scripting in modern programming languages
 1+ years of systems administration (Linux/Windows) experience

Preferred Qualifications

 Experience in technical support
 Experience scripting in one or more language (e.g. Bash, Python, Perl, Ruby)
 Experience troubleshooting and debugging technical systems
 Knowledge of web services, distributed systems, and web application development Experience troubleshooting & maintaining software.

Acknowledgement Of Country

In the spirit of reconciliation Amazon acknowledges the Traditional Custodians of country throughout Australia and their connections to land, sea and community. We pay our respect to their elders past and present and extend that respect to all Aboriginal and Torres Strait Islander peoples today.

IDE Statement

Amazon is an equal opportunity employer and does not discriminate on the basis of protected veteran status, disability, or other legally protected status.

Our inclusive culture empowers Amazonians to deliver the best results for our customers. If you have a disability and need a workplace accommodation or adjustment during the application and hiring process, including support for the interview or onboarding process, please visit https://amazon.jobs/content/en/how-we-hire/accommodations for more information. If the country/region you’re applying in isn’t listed, please contact your Recruiting Partner.


Company - Amazon Corporate Services Pty Ltd

Job ID: A10374257

Contains bad word ""Ruby"". Skipping this job!
",Skipped,Not Available
