Job ID,Job Link,Resume Tried,Date listed,Date Tried,Assumed Reason,Stack Trace,External Job link,Screenshot Name
4387618493,https://www.linkedin.com/jobs/view/4387618493,Pending,2026-03-21 11:09:27.563411,2026-04-11 11:09:27.663077,Found a Bad Word in About Job,"
About the job
About Upsun (formerly Platform.sh)

Upsun is the cloud application platform humans and robots love. It is built for today’s hybrid teams, where AI agents write and test code and humans focus on solving the problems that really matter. Developers, DevOps engineers, and platform teams use Upsun to build, ship, and scale confidently without wrestling with backend infrastructure. We give you your time back. You get:
Predictable performance, even at scale
Secure, compliant environments by default
Real-time observability and profiling built in
Cloning, configuration, and provisioning in seconds
AI-ready features that plug directly into your stack

The name says it all. ""Up"" means uptime, reliability, and acceleration. ""Sun"" reflects our follow-the-sun-support, a 24x7, globally distributed support team keeping the lights on while you rest. Our core belief is that software should power brighter solutions and greater innovation.
Upsunners are a remote, global workforce, and we thrive in a multicultural team. We are committed to open source and an open, welcoming environment. Our team spans the globe and the experience spectrum.

What's our commonality, our cultural fabric? A curious spirit and a thirst for knowledge; an eagerness for innovative ideas and cultures. We believe we can build anything together in an environment that frees you to do your best work.

Our values:
🌿 We make a positive impact.
✨ We aim for the stars.
💚 We care for each other.

Impact of a Cloud Support Engineer

Support at Upsun is more than a ticket queue - it’s about solving complex technical challenges, collaborating globally, and helping developers succeed. Our CSE’s are deeply technical, curious, and committed to creating a world-class support experience for our users.
In this customer-facing, engineering-adjacent role, you’ll help troubleshoot infrastructure, application, and deployment issues across a broad tech stack. You'll work in a high-trust, async-first environment where autonomy, problem-solving, and clear communication are key. If you enjoy tackling unsolved problems and making things better every day — this role might be for you!

What to expect

Technical resolution: Resolve technical issues across infrastructure, deployments, databases, caching, and web performance
Support management: Manage support tickets via Zendesk, with occasional live chat or voice support where needed
Platform reliability: Contribute to platform reliability by monitoring alert queues and participating in on-call rotation during working hours
Cross-team collaboration: Collaborate with Product and Engineering to escalate bugs, report edge cases, and improve internal tooling
Knowledge sharing: Improve documentation and knowledge sharing across global support teams
Web infrastructure troubleshooting: Troubleshoot issues related to DNS, CDN, SSL/TLS, and web infrastructure at scale
Continuous improvement: Identify recurring problems and suggest improvements to systems, workflows, and documentation

What you bring

Linux systems experience: You're comfortable in the terminal and can navigate production environments
Coding or scripting ability: You have experience with at least one backend language (e.g., Go, Python, PHP, Ruby, Node.js)
Cloud infrastructure familiarity: You've worked in or supported distributed systems, containerized environments, or cloud platforms
Networking basics: You understand how the internet works, and can debug issues with DNS, SSL, CDN, etc.
Strong written communication: You express technical ideas clearly and collaborate effectively in async global teams
Problem-solving mindset: You take initiative, enjoy digging into issues, and look for ways to improve how we work
Strong customer-centric mindset: You care about delivering value to users and partners. You approach problems with empathy and consider the end-user experience in your decisions.

Where we hire

At Upsun, remote work isn't just a trend - it's our foundation. The freedom of remote work with the support of a diverse, global team has been our successful model for over a decade. Our culture celebrates flexibility and collaboration, and while we have team members in over 30 countries around the globe, we are currently focused on hiring for this role in Australia. Although we’re unable to provide visa sponsorship at this time, we welcome applications from all qualified candidates who are legally authorized to work in these countries.
🕐 Please note: While we support flexible work, this is a support role that requires coverage during fixed working hours based on your Australian region:

Hours: 00:00-08:00 UTC

If you’re unable to reliably work during the required hours in your region, we unfortunately won’t be able to consider your application for this role.

How we hire

We know that a great hire won’t meet every requirement that we’ve outlined. If you can see yourself elevating the team, we want to hear your story. Few of us would be here had we not taken a chance.

You can expect 4 interviews on Google Meet to follow the order below. Should you successfully move through the entire process you will have the opportunity to meet with a variety of Upsunners. Our goal is to ensure you can make the most informed decision on whether this role, and our culture aligns with what you’re looking for in your future working environment.

45 Minutes with Talent Acquisition
60 Minutes with Hiring Manager (Manager, Support)
60 Minutes with Team (IC's)
45 Minutes with Executive (Senior Director, Support)
All roles require background checks.

What we offer

💡 A product you can believe in - Join us in transforming how businesses build and manage web applications, driven making a positive impact as a proud B Corp.
🏆 An Award-Winning Workplace - We’ve been recognized by Forbes’ Top 30 Companies for Remote Jobs and France’s Best Workplaces for Women.
🗣️ A culture that values your voice - Join a flexible, open, and inclusive work environment where your voice is encouraged, and your ideas shape our growth and evolution.
🌎 A global team - Collaborate with colleagues from diverse backgrounds across the world, embracing different perspectives
🎉 Benefits and perks - Make the most of what matters to you
🩺 Comprehensive health coverage
🏝 Flexible PTO
📈 Company stock options
🧠 Professional development budget
💻 Office equipment budget
💆 ♀️ Wellness budget
🧳 Annual team gatherings
🛜 Internet reimbursement
👶 Inclusive parental leave
✈️ Remote work travel program

You belong here

At Upsun, we celebrate diversity in all its forms and are committed to fostering an inclusive, equitable, and supportive workplace where everyone can thrive. We embrace and value different perspectives, backgrounds, and experiences, because they make us stronger as a team. Whoever you are, wherever you're from, and whatever path you've taken, you are welcome here. We encourage you to bring your whole self to work, connect with others, and share your passion. If you need accommodations at any stage of our hiring process, please let us know. We're here to ensure an accessible and comfortable experience for you.

Contains bad word ""PHP"". Skipping this job!
",Skipped,Not Available
4384225065,https://www.linkedin.com/jobs/view/4384225065,Pending,2026-03-14 11:10:25.988467,2026-04-11 11:10:26.040294,Found a Bad Word in About Job,"
About the job
We’re hiring: Software Engineers (Level 2)

Camberwell | Hybrid | 6-month Fixed Term | 2 Positions | International Not-for-profit

The Australian Council for Educational Research (ACER) is seeking two Software Engineers (Level 2) to join our Software Development team.

In this role, you will contribute to a specific web application development project that supports ACER’s mission to improve learning worldwide. You’ll work closely with developers, UX and internal clients to deliver a high-quality, reliable software solution.

What You’ll Do
Contribute to a software development project under a Lead Software Engineer
Contribute to technical documentation, test plans and design specifications
Participate in data integration and software implementation activities
Investigate, test and resolve software issues
Collaborate with internal teams and support internal client handover processes

What You Bring
Experience in object-oriented design and development
Commercial experience in PHP and JavaScript
Strong SQL and MongoDB database design capabilities
Experience with UML and producing design documentation
Understanding of development methodologies and software lifecycles
Ability to work effectively with both technical and non-technical stakeholders
Strong organisation, time management and communication skills
A Bachelor Degree in Computer Science (or equivalent)

Why Join ACER?
✨ Meaningful work with global educational impact
✨ Hybrid work flexibility
✨ Research driven, supportive and collaborative culture
✨ Professional development and wellbeing support

Interested?
Apply now or reach out to learn more.

Our commitment to Diversity and Inclusion
ACER is an equal opportunity employer and is committed to actively fostering a diverse and inclusive work environment.

We are dedicated to attracting, retaining and developing our people regardless of gender identity, cultural and faith background, sexual orientation, disability and/or age.

ACER welcomes applications from all sectors of the community.

ACER encourages applications from First Nations Australians.

ACER is committed to supporting candidates with disability through provision of adjustments during the recruitment and selection process and throughout employment.

To request or discuss adjustment requirements, please contact: p&c@acer.org

Applications close Sunday, 29 March 2026 at midnight (AEDT)

Contains bad word ""PHP"". Skipping this job!
",Skipped,Not Available
4395949461,https://www.linkedin.com/jobs/view/4395949461,Pending,2026-04-09 11:10:30.183948,2026-04-11 11:10:30.211855,Asking for Security clearance,"
About the job
Hiring: Senior Microsoft Power Apps Developer
We are looking for an experienced Power Apps Developer to join a leading client on a 6-month contract.
Location: Remote (Candidates must be based in Australia)
NV1 or NV2 Security Clearance is a MUST

🔧 Key Skills:
• Power Apps (Canvas & Model-Driven)
• Power Automate
• Dataverse
• SharePoint Migration
• Solution Design & Stakeholder Management\

If you have strong experience in building scalable Power Platform solutions and enjoy working in a collaborative environment, we’d love to hear from you!

Found ""Clearance"" or ""Polygraph"". Skipping this job!
",Skipped,Not Available
4387304250,https://www.linkedin.com/jobs/view/4387304250,Pending,2026-03-21 11:10:41.227362,2026-04-11 11:10:41.269221,Found a Bad Word in About Job,"
About the job
We have an opportunity for a Software Engineer to join our large IT division here at Service Stream, a growing ASX-listed leader in its field! If you are skilled in .NET development, AWS services and looking for a clear advancement pathway, we would encourage you to apply. We are open to varying levels of experience for this position. Please note this role is only open Australian Citizens.

About the role
You will play a critical role in designing, developing, and enhancing high‑quality software solutions that support our national operations. You will be responsible for delivering robust, scalable, and secure applications while contributing to technical decision-making, solution architecture, and continuous improvement initiatives.

Key responsibilities:
Designing, developing, and maintaining applications across front‑end, back‑end, and data layers.
Contributing to high‑level system architecture, technical direction, and solution design.
Writing clean, maintainable, and well‑tested code with a strong focus on performance and security.
Driving end‑to‑end delivery across the full SDLC — requirements, design, development, testing, deployment, and support.
Identifying, prioritising, and reducing technical debt across existing systems.
Assessing and recommending new technologies, frameworks, and engineering approaches.
Enhancing CI/CD pipelines, automation, and development tooling to uplift efficiency and reliability.
Applying cloud‑native and DevOps practices to improve scalability, resilience, and operational performance.

About you
Our ideal candidate will have problem‑solving skills and the ability to diagnose complex issues across multiple environments. You will also enjoy working with our different stakeholder groups.

You might also have:
A few years of experience in .NET development, including modern .NET (e.g., .NET 8/9) and C#.
Hands‑on experience with Python for automation, services, or workflow support.
Proven experience building APIs and microservices within a .NET Core environment.
Strong understanding of code quality, maintainability, performance optimisation, and secure development practices.
Experienced designing, deploying, and supporting cloud‑native applications on AWS.
Experience improving CI/CD pipelines and applying DevOps practices.
Bachelor’s degree in Computer Science, Information Systems, or a related field is highly desirable.
Experience working across the full software development lifecycle in delivery‑focused teams.

About us
Service Stream is an equal opportunity ASX-listed business that develops and operates Australia's essential services networks across telecommunications, utilities, transport, defence, and social infrastructure industries. We keep communities connected.

Your next role comes with:
Flexible working - all flexibility requests are genuinely considered. This role offers hybrid working of 2 days from home, and a convenience office location across from Southern Cross Station.
Career development – we offer growth opportunities and support internal mobility. You will have access to our online learning system supported by our in-house RTO, and access to participate in mentoring and leadership programs.
Access - discounts for hundreds of businesses such as Woolworths, Air BNB, The Iconic, JB HI-FI, Dan Murphys, Bupa Health Care, and Specsavers. We also offer access to novated leasing and a share matching program.
Paid leave - parental, cultural, community service, defence, study, corporate volunteering and purchased leave available.
Culture – we are dedicated to fostering a workplace environment that values safety, diversity and inclusion, and meaningful recognition.

How to apply
Please submit your interest with the apply button. Applications may be reviewed as received, so please don’t hesitate to apply!

We celebrate diversity at Service Stream and welcome applications from people who identify as Aboriginal and/or Torres Strait Islander, people with a disability or neurodivergence, and those from LGBTIQA+, Veteran or other diverse groups. If you require any reasonable adjustments to the recruitment process, please email Talent.Corporate@servicestream.com.au.

Contains bad word "".NET"". Skipping this job!
",Skipped,Not Available
4371757079,https://www.linkedin.com/jobs/view/4371757079,Pending,2026-03-28 11:10:45.184905,2026-04-11 11:10:45.222780,Found a Bad Word in About Job,"
About the job
Onyx Gaming is a trusted operational advisor and a leading force in Electronic Gaming Machine (EGM) systems. Our commitment to excellence and innovation has made us a key player in the gaming industry, empowering hospitality venues across Australia with cutting-edge solutions.

As we continue to grow, we’re on the lookout for a Software Engineer to help design, build and evolve the platforms that power our products and customer experiences.

About The Role

As the Software Engineer, you’ll design, develop and maintain secure, high-performance software that supports both our internal operations and customer-facing systems. You’ll work across backend services, APIs, integrations and modern cloud infrastructure, contributing to reliable, scalable solutions in a regulated, real-world environment.

This is a hands-on engineering role with real ownership — ideal for someone who enjoys solving complex problems, improving systems, and working closely with product, QA and business stakeholders to deliver meaningful outcomes.

In this role you will be responsible for

Designing and building backend services using C#/.NET (ASP.NET Core) and PHP (Laravel)
Developing modern front-end experiences using React / NextJS
Creating and evolving REST/gRPC APIs and integrations
Deploying and managing cloud infrastructure in AWS
Modelling and optimising data in SQL Server / PostgreSQL
Implementing automated testing across unit and integration layers
Supporting CI/CD pipelines, DevOps practices and production releases
Monitoring, troubleshooting and improving system reliability and performance
Applying secure coding practices and supporting compliance requirements
Collaborating with QA, Product and external testing partners to deliver high-quality releases
Contributing to documentation, engineering standards and continuous improvement

About You

You’re a pragmatic, hands-on engineer who enjoys both building and improving systems. You think beyond just writing code — considering reliability, security, performance and long-term maintainability.

You’re comfortable working across the stack, collaborating with others, and taking ownership of outcomes. You communicate clearly and enjoy translating technical solutions into business value.

Skills & Qualifications

5+ years’ experience building and operating production software systems in backend or full-stack roles
Strong experience with C#/.NET
Experience with React/NextJS (or similar front-end frameworks)
Experience designing and delivering production APIs and services
Solid database skills (SQL Server or PostgreSQL)
Exposure to cloud environments (AWS or Azure) and CI/CD practices
Experience with containerisation (Docker; Kubernetes a plus)
Understanding of secure development practices and authentication/authorisation
Comfortable working in agile environments and collaborating with cross-functional teams
Strong problem-solving and communication skills
Nice to have:
Experience in regulated or high-availability environments
Event-driven or messaging systems (Kafka/RabbitMQ)
Observability/monitoring tools

What We Offer

Competitive salary and benefits package.
Flexible working hours.
A collaborative and supportive work environment.
Opportunity to work with a passionate and talented team.
Employee Assistance Program (EAP) to support your wellbeing
Professional development opportunities through our L&D program and career growth.
One paid Community Day each year to volunteer or support a cause you care about.
Barista coffee machine, quarterly celebrations and regular team events.

The successful applicant will be required to obtain a VGCCC Gaming License and/or OLGR License.

Some regional and Interstate travel may be necessary in this role.

Join our team and contribute to delivering exceptional gaming compliance support services. Please attach your resume and a cover letter outlining the skills and experience you will bring to the role.

Onyx Gaming is an equal opportunity employer. We encourage applications from candidates of all backgrounds and experiences. We are actively recruiting for this position and will engage with suitable candidates as soon we have reviewed their applications.

Please note that only shortlisted candidates will be contacted.

Contains bad word "".NET"". Skipping this job!
",Skipped,Not Available
4388482213,https://www.linkedin.com/jobs/view/4388482213,Pending,2026-03-28 11:12:15.717357,2026-04-11 11:12:15.760214,Asking for Security clearance,"
About the job
This role involves transforming a 10-chapter graphic novel into an interactive online game designed for children aged 10-12. The project centers on the character Mango, guiding players through decision-based gameplay that teaches core success secrets. The goal is to create an engaging, educational experience that motivates and inspires students, leveraging storytelling and gamification to reinforce positive learning outcomes. The source material is provided as a PDF, and the final product should be accessible, visually appealing, and age-appropriate.

Deliverables

 Develop a fully functional online game based on the provided graphic novel.
 Design interactive decision points reflecting 7-10 core success secrets.
 Implement a badge/unlock system to reward player achievements.
 Create multiple narrative outcomes based on player choices.
 Ensure the game is optimized for children aged 10-12, with intuitive navigation and engaging visuals.
 Integrate educational elements seamlessly into gameplay.
 Provide documentation and support for future updates or enhancements.

Requirements

 Proven experience in game development, preferably with educational or children’s content.
 Strong skills in interactive storytelling and gamification.
 Proficiency with relevant game development platforms and tools (e.g., Unity, HTML5, or similar).
 Ability to translate narrative content into engaging gameplay mechanics.
 Experience designing for web-based platforms and ensuring cross-device compatibility.
 Excellent communication skills and ability to collaborate with content creators.
 Creative problem-solving abilities and a passion for educational innovation.
 Availability to deliver the project within agreed timelines.

About Twine

Twine is a leading freelance marketplace connecting top freelancers, consultants, and contractors with companies needing creative and tech expertise. Trusted by Fortune 500 companies and innovative startups alike, Twine enables companies to scale their teams globally.

Our Mission

Twine's mission is to empower creators and businesses to thrive in an AI-driven, freelance-first world.

Found ""Clearance"" or ""Polygraph"". Skipping this job!
",Skipped,Not Available
